{
  "receipt_type": "SYSTEM_MAPPING_RECEIPT",
  "receipt_version": "0.1",
  "source_record_ref": "cbc:synthetic-prior-auth-denial-boundary-v0-1",
  "source_claim_refs": [
    "claim:denial-letter-generated"
  ],
  "source_non_claim_refs": [
    "does_not_claim_medical_necessity",
    "does_not_claim_legal_sufficiency"
  ],
  "consumer_system_ref": "downstream:appeals-routing-review-v0-1",
  "consumer_declared_boundary_behavior": "NARROWED",
  "boundary_behavior_records": [
    {
      "claim_ref": "claim:denial-letter-generated",
      "behavior": "NARROWED",
      "mapping_note": "Downstream consumer omits an upstream non-claim but does not disclose the omission.",
      "preserved_non_claims": [
        "does_not_claim_medical_necessity"
      ],
      "dropped_non_claims": [
        "does_not_claim_legal_sufficiency"
      ],
      "dropped_non_claims_disclosed": false,
      "unresolved_pointers": [],
      "unresolved_pointer_disposition": "NONE",
      "resolution_evidence_refs": [],
      "consumer_added_claims": []
    }
  ],
  "receipt_non_claims": [
    "does_not_approve_downstream_action",
    "does_not_validate_truth",
    "does_not_validate_compliance",
    "does_not_validate_safety"
  ]
}
